text;topic
LLM используются для анализа больших объемов данных для выявления мошеннических заявлений и оценки рисков.;AI and LLMs in the insurance space
Интеграция ИИ и крупных языковых моделей в страхование привела к повышению эффективности и точности в оценке рисков и обработке страховых требований.;AI and LLMs in the insurance space
Страховщики все чаще инвестируют в технологии ИИ и LLM, чтобы оставаться конкурентоспособными на рынке.;AI and LLMs in the insurance space
Технологии искусственного интеллекта революционизируют юридическую индустрию, автоматизируя рутинные задачи и повышая эффективность.;How the legal space can use AI
Многие юридические фирмы теперь используют искусственный интеллект для анализа контрактов, прогнозирования исходов дел и проведения юридических исследований.;How the legal space can use AI
С помощью искусственного интеллекта юридические специалисты теперь могут оптимизировать свою рабочую нагрузку и сосредоточиться на более сложных и стратегических задачах.;How the legal space can use AI
Ожидается, что использование искусственного интеллекта в юридической сфере будет продолжать расти по мере того, как все больше фирм признают преимущества этой технологии.;How the legal space can use AI
Разработчики все чаще используют инструменты искусственного интеллекта для повышения эффективности программирования.;AI for coding and software development
Эти инструменты могут помочь выявить ошибки и предложить улучшения кода.;AI for coding and software development
Искусственный интеллект также может использоваться для генерации кода на основе описаний на естественном языке.;AI for coding and software development
Использование искусственного интеллекта в разработке программного обеспечения революционизирует отрасль.;AI for coding and software development
Фермеры сталкиваются с более частыми и сильными засухами, что влияет на урожайность.;The impact of climate change on global agriculture
Повышение температур вызывает сдвиги в сезонах посадки и уборки урожая.;The impact of climate change on global agriculture
Вредители и болезни распространяются на новые регионы, угрожая урожаям.;The impact of climate change on global agriculture
Изменение климата вынуждает фермеров адаптировать свои методы возделывания для обеспечения продовольственной безопасности.;The impact of climate change on global agriculture
Новые достижения в технологии аккумуляторов позволяют электромобилям преодолевать большие расстояния на одной зарядке.;Innovations in electric vehicle technology
Многие автопроизводители инвестируют значительные средства в разработку более эффективных электродвигателей для своих транспортных средств.;Innovations in electric vehicle technology
Использование систем рекуперативного торможения в электромобилях помогает увеличить их запас хода и повысить общую эффективность.;Innovations in electric vehicle technology
Инновации в инфраструктуре зарядки облегчают владельцам электромобилей поиск и использование зарядных станций.;Innovations in electric vehicle technology
Солнечные панели становятся более эффективными и доступными, делая солнечную энергию более доступной для широкой публики.;Innovations in renewable energy technologies
Ветрогенераторы разрабатываются с использованием передовых технологий для максимизации производства энергии и минимизации воздействия на окружающую среду.;Innovations in renewable energy technologies
Исследователи изучают новые методы получения энергии из океанских волн и течений.;Innovations in renewable energy technologies
Инновации в технологии хранения энергии батарей повышают надежность и эффективность систем возобновляемой энергии.;Innovations in renewable energy technologies
Экстремальные погодные явления становятся более частыми и сильными во всем мире.;The effects of climate change on global weather patterns
Учёные связывают эти изменения с воздействием изменения климата на глобальные погодные узоры.;The effects of climate change on global weather patterns
Повышение температур приводит к более сильным ураганам, жаре и сильным осадкам.;The effects of climate change on global weather patterns
Последствия этих погодных условий ощущаются сообществами повсюду.;The effects of climate change on global weather patterns
Городские зеленые зоны предоставляют так необходимый отдых от суеты и шума городской жизни.;The role of urban green spaces in enhancing city environments
"Они показали свою эффективность в улучшении качества воздуха и снижении эффекта ""городского теплового острова"".";The role of urban green spaces in enhancing city environments
Эти пространства также способствуют физической активности и психическому благополучию среди жителей города.;The role of urban green spaces in enhancing city environments
В целом, наличие зеленых зон способствует созданию более устойчивой и комфортной городской среды.;The role of urban green spaces in enhancing city environments
Усилия по сохранению морской среды привели к восстановлению нескольких исчезающих видов.;Marine conservation efforts and the health of the world's oceans
Исследователи обнаружили, что коралловые рифы находятся в опасности из-за изменения климата.;Marine conservation efforts and the health of the world's oceans
Здоровье мирового океана имеет решающее значение для выживания морской жизни.;Marine conservation efforts and the health of the world's oceans
Усилия по сокращению пластикового загрязнения показали положительные результаты в некоторых регионах.;Marine conservation efforts and the health of the world's oceans
Новые технологии переработки коренным образом меняют способ управления отходами.;Recycling technologies and waste management solutions
Эти решения помогают минимизировать воздействие нашего мусора на окружающую среду.;Recycling technologies and waste management solutions
От передовых систем сортировки до инновационных методов переработки пластика, индустрия постоянно развивается.;Recycling technologies and waste management solutions
Компании по управлению отходами инвестируют в передовые технологии для повышения эффективности переработки.;Recycling technologies and waste management solutions
Были внедрены новые экологические политики для сокращения выбросов углерода из промышленных источников.;Environmental policies and their influence on reducing carbon emissions
Эти политики направлены на стимулирование использования возобновляемых источников энергии и сокращение зависимости от ископаемого топлива.;Environmental policies and their influence on reducing carbon emissions
Эксперты считают, что эти политики окажут значительное влияние на сокращение выбросов парниковых газов.;Environmental policies and their influence on reducing carbon emissions
Многие страны теперь работают вместе, чтобы создать и ввести в действие более строгие экологические нормативы для борьбы с изменением климата.;Environmental policies and their influence on reducing carbon emissions
Технология искусственного интеллекта революционизировала способ, которым мы вычисляем таксономию и анализируем углеродный след.;AI in taxonomy calculation and carbon footprint analysis
Используя алгоритмы машинного обучения, мы теперь можем более точно классифицировать и категоризировать различные виды и их воздействие на окружающую среду.;AI in taxonomy calculation and carbon footprint analysis
Эта передовая технология имеет потенциал значительно улучшить наше понимание экологических систем и того, как человеческая деятельность влияет на них.;AI in taxonomy calculation and carbon footprint analysis
С помощью искусственного интеллекта мы можем принимать более обоснованные решения о мерах по сохранению и устойчивому развитию.;AI in taxonomy calculation and carbon footprint analysis
Общественное мнение о климатических изменениях значительно изменилось за последние несколько десятилетий.;The history of people's attitudes towards climate change
Многие люди теперь более осведомлены и обеспокоены воздействием изменения климата на окружающую среду.;The history of people's attitudes towards climate change
Исторически сложилось так, что не было консенсуса относительно серьёзности изменения климата и необходимости действий.;The history of people's attitudes towards climate change
Отношение к изменению климата продолжает меняться по мере поступления новой информации.;The history of people's attitudes towards climate change
Криптовалюта стала популярным вариантом инвестиций для многих людей.;The evolution of cryptocurrency and its impact on personal savings
Его децентрализованный характер позволяет лучше контролировать личные сбережения.;The evolution of cryptocurrency and its impact on personal savings
Однако изменчивый характер криптовалюты также может представлять риск для сбережений человека.;The evolution of cryptocurrency and its impact on personal savings
Важно, чтобы люди тщательно оценивали потенциальное влияние на свои личные финансы перед инвестированием в криптовалюту.;The evolution of cryptocurrency and its impact on personal savings
Фондовый рынок испытал резкое падение торгов сегодня.;The US stock market
Индексы Уолл-стрит отражают пульс американского корпоративного и экономического здоровья.;The US stock market
Аналитики прогнозируют потенциальное восстановление в ближайшие недели.;The US stock market
Многие внимательно следят за рынком в поисках признаков восстановления.;The US stock market
Ожидается, что уровень инфляции вырастет, поскольку центральные банки продолжают печатать больше денег.;Central banks printing money and the impact on inflation
Многие экономисты обеспокоены потенциальными долгосрочными последствиями чрезмерной печати денег на инфляцию.;Central banks printing money and the impact on inflation
Увеличение денежной массы может привести к снижению стоимости валюты, что вызовет рост цен.;Central banks printing money and the impact on inflation
Центральные банки испытывают давление в поисках баланса между стимулированием экономики и избежанием неуправляемой инфляции.;Central banks printing money and the impact on inflation
По мере развития технологий будущее банковского дела становится все более цифровым и удобным для клиентов.;The future of banking
Многие традиционные банки теперь инвестируют в онлайн и мобильные банковские платформы, чтобы оставаться конкурентоспособными в быстро развивающейся отрасли.;The future of banking
С появлением финтех-компаний будущее банковского дела также может включать в себя более инновационные и персонализированные финансовые услуги.;The future of banking
По мере изменения поведения и ожиданий потребителей, будущее банковской сферы, вероятно, будет сосредоточено на предоставлении бесшовных и эффективных впечатлений для клиентов.;The future of banking
Научитесь отслеживать свои расходы и создавать реалистичный бюджет, который подходит именно вам.;Personal finance management and smart budgeting techniques
Откройте для себя преимущества автоматизации ваших сбережений и инвестиционных взносов.;Personal finance management and smart budgeting techniques
Узнайте, как расставить приоритеты ваших финансовых целей и принимать умные решения с вашими деньгами.;Personal finance management and smart budgeting techniques
Изучите различные стратегии управления долгами и создания фонда на случай чрезвычайных ситуаций.;Personal finance management and smart budgeting techniques
Цифровые валюты центральных банков вызывают опасения по поводу конфиденциальности и слежки.;The impact of Central bank digital currencies for surveillance
Многие беспокоятся о потенциальном увеличении государственного контроля за финансовыми операциями.;The impact of Central bank digital currencies for surveillance
Использование цифровых валют может дать центральным банкам больше контроля и надзора за финансовой системой.;The impact of Central bank digital currencies for surveillance
Критики утверждают, что внедрение этих цифровых валют может привести к потере финансовой конфиденциальности для отдельных лиц.;The impact of Central bank digital currencies for surveillance
Цены на жилье на текущем рынке стабильно растут, что делает его рынком продавца.;Real estate market trends
Тем не менее, спрос на арендуемую недвижимость остается высоким, особенно в городских районах.;Real estate market trends
Инвесторы в недвижимость внимательно следят за тенденцией удаленной работы и ее влиянием на предпочтения в жилье.;Real estate market trends
Несмотря на неопределенность на рынке, эксперты прогнозируют продолжение роста продаж жилья в ближайшие месяцы.;Real estate market trends
Начинайте готовиться к пенсии заранее, чтобы обеспечить финансовую безопасность в будущем.;Retirement planning
Рассмотрите возможность обращения к финансовому консультанту, чтобы помочь создать пенсионный план, соответствующий вашим потребностям.;Retirement planning
Важно регулярно пересматривать и корректировать ваш план на пенсию по мере изменения вашего финансового положения.;Retirement planning
Разумное сбережение и инвестирование сейчас могут существенно повлиять на ваш образ жизни после выхода на пенсию.;Retirement planning
Ваш кредитный рейтинг может повлиять на возможность получения займа или кредитной карты.;Credit systems and credit scores
Важно следить за вашим кредитным отчетом на предмет ошибок или подозрительных действий.;Credit systems and credit scores
Высокий кредитный рейтинг может привести к более выгодным процентным ставкам и условиям кредитования.;Credit systems and credit scores
Понимание кредитных систем может помочь вам принимать более обоснованные финансовые решения.;Credit systems and credit scores
Инвесторы внимательно следят за результатами экономик развивающихся рынков.;The economy in emerging markets
Многие развивающиеся рыночные экономики переживают быстрый рост и привлекают иностранные инвестиции.;The economy in emerging markets
Однако некоторые развивающиеся рынки сталкиваются с такими проблемами, как инфляция и политическая нестабильность.;The economy in emerging markets
Для компаний важно тщательно оценивать риски и возможности на развивающихся рынках перед принятием инвестиционных решений.;The economy in emerging markets
